{
  "_metadata": {
    "version": "1.0",
    "description": "围棋白方棋子定义 - place/capture原语体系"
  },
  "pieces": {
    "stone": {
      "label": {
        "white": "○",
        "black": "●"
      },
      "is_king": false,
      "stone_value": 1,
      "place_rules": [
        {
          "kind": "place",
          "land": "empty",
          "where": []
        }
      ],
      "capture_rules": [
        {
          "kind": "capture",
          "condition": "no_liberties",
          "target": "enemy"
        }
      ],
      "liberty_rules": {
        "count_method": "orthogonal_adjacent",
        "group_connect": "orthogonal"
      }
    }
  },
  "side_overrides": {
    "white": {},
    "black": {}
  },
  "custom_pieces": []
}
